{"$schema":"https://json-schema.org/draft/2020-12/schema","$id":"https://ajiasu.example/schemas/audit-export-v1.json","type":"object","additionalProperties":false,"required":["export_version","event_id","created_at","tenant_id","actor_type","action","resource_type","result","request_id"],"properties":{"export_version":{"const":1},"event_id":{"type":"string","format":"uuid"},"created_at":{"type":"string","format":"date-time"},"tenant_id":{"type":["string","null"]},"actor_type":{"type":"string","enum":["user","service","system"]},"action":{"type":"string","pattern":"^[a-z0-9_.-]{1,160}$"},"resource_type":{"type":"string","pattern":"^[a-z0-9_.-]{1,80}$"},"result":{"type":"string","enum":["success","failure"]},"request_id":{"type":"string","format":"uuid"},"resource_id":{"type":["string","null"]},"details":{"type":"object","additionalProperties":true}}}
