{"export_version":1,"event_id":"018f4f48-7b0a-7e3b-8f4f-9e8f0f8b1a21","created_at":"2026-07-17T00:00:00Z","tenant_id":"018f4f48-7b0a-7e3b-8f4f-9e8f0f8b1a22","actor_type":"user","action":"accounts.account.updated","resource_type":"account","result":"success","request_id":"018f4f48-7b0a-7e3b-8f4f-9e8f0f8b1a23","resource_id":"018f4f48-7b0a-7e3b-8f4f-9e8f0f8b1a24","details":{"state":"active","version":3}}
